[
    {
        "id": "cmd-ipconfig-all",
        "command": "ipconfig /all",
        "platform": "Windows",
        "purpose": "Display detailed Windows network configuration.",
        "syntax": "ipconfig /all",
        "example": "ipconfig /all",
        "expectedResult": "Shows IPv4 address, subnet mask, default gateway, DNS server, DHCP status, and MAC address.",
        "useCase": "Troubleshooting network connectivity, checking if DHCP assigned an IP correctly.",
        "category": "Networking",
        "safety": "Read-only",
        "warnings": null,
        "keywords": [
            "ipconfig",
            "ip",
            "dhcp",
            "mac",
            "dns",
            "subnet",
            "adapter",
            "windows",
            "network"
        ]
    },
    {
        "id": "cmd-ping",
        "command": "ping",
        "platform": "Windows/Linux",
        "purpose": "Test reachability of a host on an IP network.",
        "syntax": "ping <hostname or IP>",
        "example": "ping 8.8.8.8",
        "expectedResult": "Replies from the destination indicating latency and packet loss.",
        "useCase": "Verifying internet connection or if a specific server is online.",
        "category": "Networking",
        "safety": "Read-only",
        "warnings": null,
        "keywords": [
            "ping",
            "icmp",
            "latency",
            "packet loss",
            "reachability",
            "connectivity",
            "network"
        ]
    },
    {
        "id": "cmd-tracert",
        "command": "tracert",
        "platform": "Windows",
        "purpose": "Trace the path that an IP packet takes to its destination.",
        "syntax": "tracert <hostname or IP>",
        "example": "tracert google.com",
        "expectedResult": "List of routers (hops) the packet passed through and response times.",
        "useCase": "Finding where a network connection drops or slows down.",
        "category": "Networking",
        "safety": "Read-only",
        "warnings": null,
        "keywords": [
            "tracert",
            "traceroute",
            "hops",
            "latency",
            "route",
            "path",
            "icmp",
            "troubleshooting"
        ]
    },
    {
        "id": "cmd-nslookup",
        "command": "nslookup",
        "platform": "Windows/Linux",
        "purpose": "Query Internet name servers interactively.",
        "syntax": "nslookup <hostname>",
        "example": "nslookup example.com",
        "expectedResult": "IP addresses associated with the domain name.",
        "useCase": "Troubleshooting DNS resolution issues.",
        "category": "Networking",
        "safety": "Read-only",
        "warnings": null,
        "keywords": [
            "nslookup",
            "dns",
            "domain",
            "nameserver",
            "lookup",
            "ip",
            "records",
            "troubleshooting"
        ]
    },
    {
        "id": "cmd-netstat-tuln",
        "command": "netstat -tuln",
        "platform": "Linux / net-tools",
        "purpose": "Displays active listening TCP and UDP sockets. Note: 'netstat -tuln' is specific to Linux net-tools; netstat is legacy on modern Linux where 'ss' is the preferred modern socket-inspection tool. Windows netstat uses different parameter flags (-ano).",
        "syntax": "netstat -tuln",
        "example": "netstat -tuln",
        "expectedResult": "Active Internet connections (only servers)\nProto Recv-Q Send-Q Local Address           Foreign Address         State\ntcp        0      0 0.0.0.0:22              0.0.0.0:*               LISTEN\ntcp        0      0 127.0.0.1:3306          0.0.0.0:*               LISTEN\nudpv6      0      0 :::5353                 :::*",
        "useCase": "Inspecting open listening ports on legacy Linux servers where iproute2/ss is unavailable.",
        "category": "Networking",
        "safety": "Read-only",
        "warnings": null,
        "keywords": [
            "netstat",
            "netstat -tuln",
            "ss",
            "tcp",
            "udp",
            "ports",
            "listening",
            "sockets",
            "linux",
            "net-tools"
        ]
    },
    {
        "id": "cmd-sfc-scannow",
        "command": "sfc /scannow",
        "platform": "Windows",
        "purpose": "Scans and verifies the integrity of all protected system files.",
        "syntax": "sfc /scannow",
        "example": "sfc /scannow",
        "expectedResult": "Verifies files and replaces incorrect versions with correct Microsoft versions.",
        "useCase": "Fixing corrupted Windows system files causing crashes or strange behavior.",
        "category": "System",
        "safety": "Configuration-changing",
        "warnings": "Must be run as Administrator.",
        "keywords": [
            "windows",
            "sfc",
            "system"
        ]
    },
    {
        "id": "cmd-systeminfo",
        "command": "systeminfo",
        "platform": "Windows",
        "purpose": "Displays detailed configuration information about a computer and its operating system.",
        "syntax": "systeminfo",
        "example": "systeminfo",
        "expectedResult": "Outputs OS version, system manufacturer, BIOS version, memory stats, hotfixes, and network card info.",
        "useCase": "Quickly auditing computer specs, uptime, OS installation date, and installed Windows updates.",
        "category": "System",
        "safety": "Read-only",
        "warnings": null,
        "keywords": [
            "windows",
            "system",
            "systeminfo"
        ]
    },
    {
        "id": "cmd-tasklist",
        "command": "tasklist",
        "platform": "Windows",
        "purpose": "Displays a list of currently running processes on either a local or remote machine.",
        "syntax": "tasklist",
        "example": "tasklist /v",
        "expectedResult": "Shows Image Name, PID, Session Name, Session Number, and Memory Usage for every running process.",
        "useCase": "Identifying runaway processes, finding specific service PIDs, or scripting health checks.",
        "category": "System",
        "safety": "Read-only",
        "warnings": null,
        "keywords": [
            "windows",
            "system",
            "tasklist"
        ]
    },
    {
        "id": "cmd-chkdsk",
        "command": "chkdsk",
        "platform": "Windows",
        "purpose": "Checks the file system and volume metadata for logical and physical errors.",
        "syntax": "chkdsk [volume:] [/f] [/r]",
        "example": "chkdsk C: /f",
        "expectedResult": "Scans filesystem sectors, repairs directory corruption, and locates bad sectors.",
        "useCase": "Troubleshooting corrupted disk partitions, file access errors, or failing drives.",
        "category": "System",
        "safety": "Configuration-changing",
        "warnings": "Must be run as Administrator. May require a system restart to dismount volume.",
        "keywords": [
            "windows",
            "chkdsk",
            "system"
        ]
    },
    {
        "id": "cmd-gpupdate-force",
        "command": "gpupdate /force",
        "platform": "Windows",
        "purpose": "Forces immediate background reapplication of all Active Directory Group Policy settings.",
        "syntax": "gpupdate /force",
        "example": "gpupdate /force",
        "expectedResult": "Outputs: Updating policy... Computer Policy update has completed successfully. User Policy update has completed successfully.",
        "useCase": "Applying newly configured GPO security policies or mapped drives without waiting for the default 90-minute refresh.",
        "category": "System",
        "safety": "Configuration-changing",
        "warnings": null,
        "keywords": [
            "windows",
            "gpupdate",
            "system"
        ]
    },
    {
        "id": "cmd-driverquery",
        "command": "driverquery",
        "platform": "Windows",
        "purpose": "Enables an administrator to display a comprehensive list of installed device drivers.",
        "syntax": "driverquery [/v]",
        "example": "driverquery /v",
        "expectedResult": "Displays table of module name, display name, driver type, and link date.",
        "useCase": "Troubleshooting BSOD crashes and hardware device driver incompatibility.",
        "category": "System",
        "safety": "Read-only",
        "warnings": null,
        "keywords": [
            "driverquery",
            "windows",
            "system"
        ]
    },
    {
        "id": "cmd-wmic",
        "command": "wmic",
        "platform": "Windows",
        "purpose": "Windows Management Instrumentation command-line utility for advanced system queries.",
        "syntax": "wmic <alias> [options]",
        "example": "wmic bios get serialnumber",
        "expectedResult": "Returns specific hardware metadata such as device serial number, CPU model, or disk health.",
        "useCase": "Automated IT asset inventory, retrieving motherboard and BIOS serial numbers remotely.",
        "category": "System",
        "safety": "Read-only",
        "warnings": "WMIC is deprecated in newer Windows 11 builds in favor of CIM/WMI PowerShell cmdlets.",
        "keywords": [
            "windows",
            "wmic",
            "system"
        ]
    },
    {
        "id": "cmd-ss-tulpn",
        "command": "ss -tulpn",
        "platform": "Linux",
        "purpose": "Displays all listening TCP and UDP sockets with numeric ports and associated process IDs.",
        "syntax": "ss -tulpn",
        "example": "ss -tulpn | grep ':80'",
        "expectedResult": "Netid State Recv-Q Send-Q Local Address:Port Peer Address:Port Process\ntcp LISTEN 0 128 0.0.0.0:80 0.0.0.0:* users:((\"nginx\",pid=1024,fd=6))",
        "useCase": "Identifying which service or daemon is bound to a network port and diagnosing port conflicts.",